{"command":"ls","version":"dcdd733","schemaVersion":"1.0","exitCode":0,"data":{"path":"/tmp","files":[{"name":"claude-1000","path":"/tmp/claude-1000","size":60,"mode":"drwx------","modTime":"2026-05-12T15:21:35.555360747-07:00","isDir":true,"owner":"ramayac","group":"ramayac","inode":200,"links":3,"blocks":0},{"name":"com.google.Chrome.NrRA8O","path":"/tmp/com.google.Chrome.NrRA8O","size":80,"mode":"drwx------","modTime":"2026-05-12T15:18:32.837727504-07:00","isDir":true,"owner":"ramayac","group":"ramayac","inode":127,"links":2,"blocks":0},{"name":"com.google.Chrome.Z4y3w1","path":"/tmp/com.google.Chrome.Z4y3w1","size":60,"mode":"drwx------","modTime":"2026-05-12T15:18:33.44457148-07:00","isDir":true,"owner":"ramayac","group":"ramayac","inode":137,"links":2,"blocks":0},{"name":"gen_golden.sh","path":"/tmp/gen_golden.sh","size":2491,"mode":"-rw-rw-r--","modTime":"2026-05-12T15:52:08.398981693-07:00","isDir":false,"owner":"ramayac","group":"ramayac","inode":3483,"links":1,"blocks":8},{"name":"gen_remaining.sh","path":"/tmp/gen_remaining.sh","size":2974,"mode":"-rw-rw-r--","modTime":"2026-05-12T15:54:15.120954788-07:00","isDir":false,"owner":"ramayac","group":"ramayac","inode":3498,"links":1,"blocks":8},{"name":"gen_schemas.sh","path":"/tmp/gen_schemas.sh","size":14901,"mode":"-rw-rw-r--","modTime":"2026-05-12T15:47:24.354212848-07:00","isDir":false,"owner":"ramayac","group":"ramayac","inode":3288,"links":1,"blocks":32},{"name":"insync1000.sock","path":"/tmp/insync1000.sock","size":0,"mode":"Srw-------","modTime":"2026-05-12T15:18:40.549248447-07:00","isDir":false,"owner":"ramayac","group":"ramayac","inode":157,"links":1,"blocks":0},{"name":"goposix-test-dir","path":"/tmp/goposix-test-dir","size":40,"mode":"drwxr-xr-x","modTime":"2026-05-12T15:52:08.483980509-07:00","isDir":true,"owner":"ramayac","group":"ramayac","inode":3484,"links":2,"blocks":0},{"name":"goposix-test-file","path":"/tmp/goposix-test-file","size":0,"mode":"-rw-r--r--","modTime":"2026-05-12T15:52:08.488288177-07:00","isDir":false,"owner":"ramayac","group":"ramayac","inode":3485,"links":1,"blocks":0},{"name":"goposix_chmod_test","path":"/tmp/goposix_chmod_test","size":0,"mode":"-rw-r--r--","modTime":"2026-05-12T15:54:15.158952372-07:00","isDir":false,"owner":"ramayac","group":"ramayac","inode":3508,"links":1,"blocks":0},{"name":"goposix_cp_dst.txt","path":"/tmp/goposix_cp_dst.txt","size":3335,"mode":"-rw-r--r--","modTime":"2026-05-12T15:54:15.131954089-07:00","isDir":false,"owner":"ramayac","group":"ramayac","inode":3502,"links":1,"blocks":8},{"name":"goposix_cp_src.txt","path":"/tmp/goposix_cp_src.txt","size":3335,"mode":"-rw-r--r--","modTime":"2026-05-12T15:54:15.129376635-07:00","isDir":false,"owner":"ramayac","group":"ramayac","inode":3501,"links":1,"blocks":8},{"name":"goposix_dst.txt","path":"/tmp/goposix_dst.txt","size":0,"mode":"-rw-rw-r--","modTime":"2026-05-12T15:54:15.126954406-07:00","isDir":false,"owner":"ramayac","group":"ramayac","inode":3500,"links":1,"blocks":0},{"name":"goposix_ln_test","path":"/tmp/goposix_ln_test","size":11,"mode":"Lrwxrwxrwx","modTime":"2026-05-12T15:54:15.141953453-07:00","isDir":false,"owner":"ramayac","group":"ramayac","inode":3505,"links":1,"target":"/etc/passwd","blocks":0},{"name":"goposix_mv_dst.txt","path":"/tmp/goposix_mv_dst.txt","size":0,"mode":"-rw-rw-r--","modTime":"2026-05-12T15:54:15.135953834-07:00","isDir":false,"owner":"ramayac","group":"ramayac","inode":3503,"links":1,"blocks":0},{"name":"goposix_src.txt","path":"/tmp/goposix_src.txt","size":0,"mode":"-rw-rw-r--","modTime":"2026-05-12T15:54:15.126954406-07:00","isDir":false,"owner":"ramayac","group":"ramayac","inode":3499,"links":1,"blocks":0},{"name":"kup-daemon-ramayac","path":"/tmp/kup-daemon-ramayac","size":0,"mode":"Srwxrwxr-x","modTime":"2026-05-12T15:18:29.190571512-07:00","isDir":false,"owner":"ramayac","group":"ramayac","inode":105,"links":1,"blocks":0},{"name":"mcp-EvYR4P","path":"/tmp/mcp-EvYR4P","size":60,"mode":"drwx------","modTime":"2026-05-12T15:24:55.555392005-07:00","isDir":true,"owner":"ramayac","group":"ramayac","inode":360,"links":2,"blocks":0},{"name":"plasma-csd-generator.GuuQSw","path":"/tmp/plasma-csd-generator.GuuQSw","size":40,"mode":"drwx------","modTime":"2026-05-12T15:18:27.574571524-07:00","isDir":true,"owner":"ramayac","group":"ramayac","inode":56,"links":2,"blocks":0},{"name":"pms-eb136160-1954-4b90-902c-4eb986b535fe","path":"/tmp/pms-eb136160-1954-4b90-902c-4eb986b535fe","size":40,"mode":"drwxr-xr-x","modTime":"2026-05-12T15:16:05.22316092-07:00","isDir":true,"owner":"plex","group":"plex","inode":36,"links":2,"blocks":0},{"name":"sddm--YKJDfO","path":"/tmp/sddm--YKJDfO","size":0,"mode":"Srwx------","modTime":"2026-05-12T15:15:59.350572624-07:00","isDir":false,"owner":"sddm","group":"sddm","inode":29,"links":1,"blocks":0},{"name":"sddm-auth-dd49cdd8-cf97-42d6-af46-83ae774c0d9a","path":"/tmp/sddm-auth-dd49cdd8-cf97-42d6-af46-83ae774c0d9a","size":0,"mode":"Srwxr-xr-x","modTime":"2026-05-12T15:15:59.350572624-07:00","isDir":false,"owner":"root","group":"root","inode":27,"links":1,"blocks":0},{"name":"snap-private-tmp","path":"/tmp/snap-private-tmp","size":40,"mode":"drwx------","modTime":"2026-05-12T15:15:58.282960123-07:00","isDir":true,"owner":"root","group":"root","inode":2,"links":2,"blocks":0},{"name":"streamdeck_ui.lock","path":"/tmp/streamdeck_ui.lock","size":0,"mode":"-rw-rw-r--","modTime":"2026-05-12T15:18:30.185571504-07:00","isDir":false,"owner":"ramayac","group":"ramayac","inode":117,"links":1,"blocks":0},{"name":"streamdeck_ui.sock","path":"/tmp/streamdeck_ui.sock","size":0,"mode":"Srwx------","modTime":"2026-05-12T15:18:30.245571504-07:00","isDir":false,"owner":"ramayac","group":"ramayac","inode":118,"links":1,"blocks":0},{"name":"systemd-private-5320e22227044cfe8feecccb3e4b3fd9-ModemManager.service-s3JCaH","path":"/tmp/systemd-private-5320e22227044cfe8feecccb3e4b3fd9-ModemManager.service-s3JCaH","size":60,"mode":"drwx------","modTime":"2026-05-12T15:15:58.796572628-07:00","isDir":true,"owner":"root","group":"root","inode":23,"links":3,"blocks":0},{"name":"systemd-private-5320e22227044cfe8feecccb3e4b3fd9-bluetooth.service-dDSXLy","path":"/tmp/systemd-private-5320e22227044cfe8feecccb3e4b3fd9-bluetooth.service-dDSXLy","size":60,"mode":"drwx------","modTime":"2026-05-12T15:15:58.55657263-07:00","isDir":true,"owner":"root","group":"root","inode":7,"links":3,"blocks":0},{"name":"systemd-private-5320e22227044cfe8feecccb3e4b3fd9-bolt.service-NTyGDS","path":"/tmp/systemd-private-5320e22227044cfe8feecccb3e4b3fd9-bolt.service-NTyGDS","size":60,"mode":"drwx------","modTime":"2026-05-12T15:15:58.79872703-07:00","isDir":true,"owner":"root","group":"root","inode":25,"links":3,"blocks":0},{"name":"systemd-private-5320e22227044cfe8feecccb3e4b3fd9-fwupd.service-XcrMiW","path":"/tmp/systemd-private-5320e22227044cfe8feecccb3e4b3fd9-fwupd.service-XcrMiW","size":60,"mode":"drwx------","modTime":"2026-05-12T15:33:43.635284328-07:00","isDir":true,"owner":"root","group":"root","inode":417,"links":3,"blocks":0},{"name":"systemd-private-5320e22227044cfe8feecccb3e4b3fd9-lm-sensors.service-q9YnmP","path":"/tmp/systemd-private-5320e22227044cfe8feecccb3e4b3fd9-lm-sensors.service-q9YnmP","size":60,"mode":"drwx------","modTime":"2026-05-12T15:15:58.567483165-07:00","isDir":true,"owner":"root","group":"root","inode":11,"links":3,"blocks":0},{"name":"systemd-private-5320e22227044cfe8feecccb3e4b3fd9-polkit.service-BV1Lpy","path":"/tmp/systemd-private-5320e22227044cfe8feecccb3e4b3fd9-polkit.service-BV1Lpy","size":60,"mode":"drwx------","modTime":"2026-05-12T15:15:58.568615598-07:00","isDir":true,"owner":"root","group":"root","inode":15,"links":3,"blocks":0},{"name":"systemd-private-5320e22227044cfe8feecccb3e4b3fd9-power-profiles-daemon.service-mgvFRe","path":"/tmp/systemd-private-5320e22227044cfe8feecccb3e4b3fd9-power-profiles-daemon.service-mgvFRe","size":60,"mode":"drwx------","modTime":"2026-05-12T15:16:07.394572564-07:00","isDir":true,"owner":"root","group":"root","inode":37,"links":3,"blocks":0},{"name":"systemd-private-5320e22227044cfe8feecccb3e4b3fd9-switcheroo-control.service-40tTPK","path":"/tmp/systemd-private-5320e22227044cfe8feecccb3e4b3fd9-switcheroo-control.service-40tTPK","size":60,"mode":"drwx------","modTime":"2026-05-12T15:15:58.579944582-07:00","isDir":true,"owner":"root","group":"root","inode":17,"links":3,"blocks":0},{"name":"systemd-private-5320e22227044cfe8feecccb3e4b3fd9-systemd-logind.service-FfwCPL","path":"/tmp/systemd-private-5320e22227044cfe8feecccb3e4b3fd9-systemd-logind.service-FfwCPL","size":60,"mode":"drwx------","modTime":"2026-05-12T15:15:58.58657263-07:00","isDir":true,"owner":"root","group":"root","inode":19,"links":3,"blocks":0},{"name":"systemd-private-5320e22227044cfe8feecccb3e4b3fd9-upower.service-xIooBZ","path":"/tmp/systemd-private-5320e22227044cfe8feecccb3e4b3fd9-upower.service-xIooBZ","size":60,"mode":"drwx------","modTime":"2026-05-12T15:18:19.93257158-07:00","isDir":true,"owner":"root","group":"root","inode":45,"links":3,"blocks":0},{"name":"vscode-goyRQheQ","path":"/tmp/vscode-goyRQheQ","size":40,"mode":"drwx------","modTime":"2026-05-12T15:34:55.269748261-07:00","isDir":true,"owner":"ramayac","group":"ramayac","inode":2266,"links":2,"blocks":0},{"name":"vscode-typescript1000","path":"/tmp/vscode-typescript1000","size":40,"mode":"drwxrwxr-x","modTime":"2026-05-12T15:24:53.208561088-07:00","isDir":true,"owner":"ramayac","group":"ramayac","inode":358,"links":2,"blocks":0}],"total":37},"error":null}
